,country_encoded,points_scaled,description_clean,variety_encoded,length_scaled,price_scaled
675,3,0.05746219098077744,intense nervy young cab impress powerful oak cassis flavor little sharp acidic jamminess tea like tannic structure suggests moderate aging capability stash open couple year,12,0.2213431156373479,0.40882833349540515
676,0,1.5431426728154198,firm solid chunky great success château currently top form even difficult year bright fruit charge tannin giving richness balancing elegance freshness year worth aging,7,0.07724629280233614,0.9920887340598284
677,2,0.05746219098077744,bright aggressive llopart lively orange apricot aroma frothy point bubbly ripe bouncy pink grapefruit citrus flavor stay racy citrusy finish fruit complex,85,-0.2109473528676874,-0.34141587203976637
678,2,-0.5368100017530796,start sharp funky quickly realize showing sign age blend sweet sour note bouquet issuing primary grapefruit flavor mustard green finish feel chunky losing zest day day,98,0.36543993847235967,-0.9491228357574785
679,3,0.05746219098077744,syrah bordeaux style blend feauturing mostly cabernet merlot rich entry feature berry chocolate espresso round midpalate polished tannin hint tar run finish,7,-0.2109473528676874,0.10351997739105015
680,1,-0.23967390538615105,blue flower red berry aroma lead way along whiff eucalyptus firm offer hint star anise espresso green note powdered sage back unripe red cherry close coffee note,72,0.5095367613073715,0.10351997739105015
681,0,1.8402787691823483,layered botrytis give richness dense texture sweet dry core crisp acidity age well going beautiful tropical fruit apricot wonderful final acidity drink,8,-0.2109473528676874,0.9920887340598284
682,3,-1.7253543872207935,peachy canyon least expensive soft simple rather sweet candied raspberry cherry flavor,104,-1.651915581217805,-1.2968273762284732
683,3,1.2460065764484913,lush thick chewy rich purple black fruit pepper finish vanilla cream tannin substantial intrusive carry sensation rock graphite flavor extend gracefully ripe fruit remains front center finish plenty nuanced rock spice hint herb exceptional effort,87,1.6623113439874655,0.046749800602869554
684,0,0.6517343837146344,perfumed fruit offer ripe counterpoint solid tannin dark cherry touch wood layer acidity come together well leaving chance age drink,28,-0.49914099853771093,-0.2701472511310363
685,2,0.35459828734770593,need air show best first tight mulchy nutty early feel clampy scratchy becomes better air black fruit flavor touched note oak dried cheese extend onto finish,89,0.36543993847235967,1.3459384551344749
686,3,-0.833946098120008,nice buy price dry jammy feature ripe flavor blackberry cherry anise cocoa mint smoky oaky note mouthwateringly crisp coastal acidity,87,-0.49914099853771093,-1.5765694367170668
687,0,-1.1310821944869365,obviously first flush youth dry rosé go mature almond marzipan along cranberry juice flavor give tightness texture definitely drunk screwcap,10,-0.49914099853771093,-1.0571964510798075
688,3,-0.23967390538615105,winery popular cali cabernet sauvignon merlot sangiovese nice aromatics lead medium bodied bright spice strawberry preserve sour plum defining acidity lick chocolate finish,72,-0.06685053003267563,-0.7518880949754525
689,1,0.35459828734770593,cheerful rosso di montalcino offer distinctively oak driven bouquet smoke spice mesquite followed bright ensemble berry fruit aroma soft slightly sweet finish burst cherry blueberry close,81,0.36543993847235967,0.1584284976948453
690,3,-0.23967390538615105,immediately appealing lush direct flavor blackberry pie filling cherry jam licorice cedar flavor vein dried herb drink,12,-0.9314314670427463,0.8193005564310913
691,2,0.05746219098077744,harmonious bouquet aroma berry marzipan nutmeg feel little acidic add freshness package flavor earthy roasted fruit touch salty finish taste briney baked note coffee toast blend tempranillo merlot caberent sauvignon,72,0.9418272298124067,-0.20178837871330557
692,3,1.8402787691823483,amazingly delicious soft defines modern napa cabernet style tasteful elegance hall wine known merlot display dazzlingly rich flavor blackberry black cherry red currant mocha savory note bacon,12,0.5095367613073715,1.1487037143524497
693,1,-1.1310821944869365,simple fuss prosecco extra dry interesting herbal component recall dried oregano hay peach citrus fruit back carried forward spicy effervescence mouthfeel thin tonic,71,-0.06685053003267563,-1.2968273762284732
694,2,-1.428218290853865,seems sort waxy baked mildly acrid aroma burnt corn leading way k feel flavor rather bitter burnt fruit pointed expressive may already past prime imported winery exchange,98,0.5095367613073715,-1.736172035706249
695,3,-0.833946098120008,dark thick tannin sturdy plenty fleshy blackberry coffee flavor bone dry probably age year,87,-1.3637219355477814,-0.4937535579628242
696,3,0.05746219098077744,sourced old vine wädenswil clone effort carry new elkton ava designation pretty raspberry strawberry fruit set lightly toasty tannin lovely everyday pinot noir density,66,0.07724629280233614,-0.2701472511310363
697,2,-2.3196265799546505,prieto picudo variety unknown drinker probably good thing grape yield acidic tight astringent wine like yes color size much balance charm,69,-0.3550441757026992,-0.4937535579628242
698,3,-1.7253543872207935,ripe almost raisiny cooked fruit although fully dry tannin harsh side stewed character seems accentuate acidity drink,104,-0.9314314670427463,-0.6613492978335797
699,3,0.6517343837146344,blend viognier roussanne marsanne moderately aromatic note pear melon apricot flower medium bodied abundant stone fruit flavor quite reserved considering warmth,74,-0.3550441757026992,0.046749800602869554
700,1,-0.23967390538615105,fresh bright rosé central italy delicate bouquet wild flower forest berry luminous pristine would pair appetizer light summer pasta chicken curry salad mouth taste fresh crisp clean,77,0.5095367613073715,-1.2968273762284732
701,3,-0.833946098120008,bit tough sharp bad cabernet deep flavor blackberry currant cola anise cedar bone dry bet declassified high end blend,12,-0.6432378213727227,-0.4937535579628242
702,1,-0.23967390538615105,bright brambly berry forest floor note open bouquet nergroamaro malvasia nera blend touch cherry sun ripened prune also make appearance especially finish,72,-0.2109473528676874,-0.9491228357574785
703,3,-0.5368100017530796,kind overripe raisin prune detracts dry chocolate cassis finish flatters tannin soft sweet,104,-1.5078187583827933,0.1584284976948453
704,3,0.6517343837146344,future vintage bear new red mountain appellation klipsun located waterbrook grape proud juicy ripe white bursting scent flavor fresh fruit cut grass light spice even toasted coconut extended finish best buy,83,1.0859240526474185,-1.9126045234463094
705,2,-1.428218290853865,nothing special blend tempranillo shiraz fact austere less pleasing brand basic temp shiraz blend said show thin raspberry flavor tangy almost sour back end probably best food real good,91,0.797730406977395,-1.2968273762284732
706,0,-0.23967390538615105,robust full nicely structured good acidity medium tannin red offer load jammy raspberry blueberry accent carnation mocha pepper spice appear mouth follow long evolving finish,73,0.2213431156373479,-0.4937535579628242
707,1,-0.23967390538615105,gold color ton oak know work resin vanilla aroma time become attractive rich deal coconut toffee baked white fruit yes barrique bomber hot climate interesting go well roast fowl foie gras,15,1.0859240526474185,-0.012012714118408771
708,0,0.35459828734770593,vibrant lively red fruit aroma blend fragrant woody spice bouquet cherry berry flavor transition somewhat gripping tannin coupled note fudgy brownie black pepper add depth finish,73,0.36543993847235967,-1.5765694367170668
709,3,-0.5368100017530796,sweet style sparkling brisk acidity framing orange lime vanilla honey flavor nice wedding cake good price,85,-1.075528289877758,-1.430863679601894
710,3,1.5431426728154198,terrific mouthfeel highlight mix berry cherry fruit toast cinnamon tart focused aged roughly half new french oak first month transferred neutral barrel another five month fine grained tannin give elegant finish,66,1.0859240526474185,1.8670825248450613
711,1,-1.1310821944869365,crisp light redolent red apple forest berry pair fried chicken easy pasta dish sharp bitter berry note close,53,-0.7873346442077345,-1.5765694367170668
712,3,-1.7253543872207935,appellation west side salina valley santa lucia highland great white red fare less well especially vine overcropped seem thin acidic merlot show candied flavor cherry mint,51,0.36543993847235967,-1.2968273762284732
713,3,-0.833946098120008,pretty good cab price little soft ripe enough upfront blackberry cherry flavor chocolate fudge note mark many modern cab pleasantly dry real complexity,12,-0.06685053003267563,-0.6613492978335797
714,3,0.05746219098077744,fruit come two great yakima valley vineyard boushey elerding although alcohol pin meter hold together pretty cherry fruit plenty acid tannin provide backbone case produced,80,0.2213431156373479,-0.6613492978335797
715,3,1.8402787691823483,term vintner select unregulated abused really mean something winery top excellent effort spent month oak extra depth cherry cassis fruit packing powerful compact punch way long polished finish,66,0.6536335841423832,1.4238390048510892
716,1,-1.428218290853865,slightly gaseous nose losing freshness passing day zingy acid keeping alive flavor slipping toward cranberry tomato much else left,72,-0.6432378213727227,1.7667795027482895
717,3,0.9488704800815629,real strength fruit show depth nerve muscle nice high note suggesting citrus even grapefruit racy berry fruit flavor come impact tannin espresso add real excitement mouth powerful zing leaf wanting,50,0.9418272298124067,0.5852608212354656
718,2,-0.833946098120008,briny citrus feline note pithy scent send merseguera led blend toward pulpy citrusy grapefruit pithy lightly bitter flavor finish citric little change primary flavor,102,0.07724629280233614,-1.736172035706249
719,3,0.6517343837146344,delicious talley rincon showing class vineyard maybe best lacking elegance ultrarich full bodied massive raspberry cherry flavor drink soon,66,-0.6432378213727227,1.2360918805832828
720,3,0.35459828734770593,feature tempting clove black cherry pomegranate flavor great balance easygoing texture clean fruity finish medium full bodied oaky flavor tannin stay well within bound,87,0.07724629280233614,-1.0571964510798075
721,3,-1.1310821944869365,rich cherry blackberry raspberry herb flavor rhône blend sweet sour berry cherry flavor rich dry furry tannin need something big meaty soften like beef stew,72,0.2213431156373479,-1.430863679601894
722,3,0.05746219098077744,vineyard going change shift focus winemaker predilection early picking seemed conspire produce rather thin austere locked tight bit herbal lean yet revealing even aeration one mystery wine keep coming back waiting light blink,12,1.3741176983174421,0.1584284976948453
723,3,0.05746219098077744,fragrant ripe brightly colored cab franc mix flavor pomegranate red currant spicy cherry red apple forward nicely fruity leaf new oak finish clean crisp,10,0.07724629280233614,-0.6613492978335797
724,3,-0.5368100017530796,ton ripe juicy come napa monterey lodi interesting combination cool warm climate bursting cherry blackberry red licorice cola cocoa date vanilla spice also balanced,12,0.07724629280233614,-1.2968273762284732
725,1,-0.23967390538615105,terre di giumara line value wine nero avola offer bright aroma berry cassis fennel moist earth almond recall natural fragrance sicily simple fresh clean close,58,0.2213431156373479,-1.2968273762284732
726,3,0.05746219098077744,great sweetness make success delicious offering mouthful chocolate covered cherry candy flavor sharpness cassis crisp acidity fine dusty tannin make elegant,68,-0.3550441757026992,0.45470955519741424
727,0,-1.1310821944869365,curious soapy considerable bitterness toasty edge show maturity contrast tense tight acidity,85,-1.651915581217805,-0.4937535579628242
728,3,-0.23967390538615105,packaged unusual plastic style recyclable bag seal figure open fine sauvignon blanc equivalent buck regular dry crisp fruity lime gooseberry flavor delivers lot bang buck,83,0.2213431156373479,-0.4937535579628242
729,3,-1.428218290853865,second label velocity cellar light modest characteristic,10,-2.372399695392864,-0.6613492978335797
730,1,-0.23967390538615105,blend inzolia viognier feel slender tight drying note talcum powder behind flavor citrus honeysuckle stone fruit,102,-1.075528289877758,-1.0571964510798075
731,1,-1.1310821944869365,fresh easy blend trebbiano chardonnay sauvignon attractive low price offer clean intense aroma cut grass field flower lemon render sweet chewy sensation mouth soft texture creamy finish,102,0.5095367613073715,-1.430863679601894
732,3,0.9488704800815629,though varietally labeled intriguing white rhône includes marsanne grenache blanc rich satisfying brings buttery density ripe chardonnay mix fruit apricot banana bit papaya total yum fest,100,0.36543993847235967,-0.34141587203976637
733,1,0.6517343837146344,delicate feminine rosé sparkler open beautifully pale pink color subtle aroma wild berry tangerine skin white almond passion fruit show elegance fine perlage tangy crispness,85,0.2213431156373479,0.49936713063727806
734,3,-0.5368100017530796,blended two finished wine counoise viognier ripe round showing strawberry peach flavor two grape work together well create seamless plenty fruit power,77,-0.2109473528676874,-0.6613492978335797
735,0,0.05746219098077744,perfumed ripe fruit flavor range mango peach taut citric finish hint wood bright fruity delicious drink,15,-1.075528289877758,1.6600835591081358
736,3,-0.833946098120008,sharp bit green peavine citrus flavor citrus mix flesh rind sour candy fermented stainless,100,-1.3637219355477814,-0.34141587203976637
737,3,-0.23967390538615105,soft ripe decadent pinot napa side carneros brim blackberry cherry cola vanilla licorice cinnamon spice flavor full bodied pinot elegant silkiness best couple year,66,0.07724629280233614,0.626610078506277
738,3,-0.23967390538615105,lot delicious raspberry cherry flavor spicy sweet probably combination residual sugar extraordinarily high alcohol make almost port like,104,-0.7873346442077345,0.40882833349540515
739,3,0.6517343837146344,cabernet franc signature barrister since first release come dark smoky house style spine muscle barrister merlot fully ripe vegetal though find characteristic cab franc streak pepper coffee behind ripe black cherry cassis fruit,10,1.3741176983174421,-0.012012714118408771
740,3,0.9488704800815629,best yet lot pineapple celilo fruit crisp lightly butterscotchy big heavy alcohol mid range fill midpalate nicely weaving together rock metal butter tropical fruit flavor equal proportion good length also,15,0.9418272298124067,0.40882833349540515
741,3,0.05746219098077744,nice chardonnay drink shellfish particularly grilled shrimp dry crisp acidity rich pineapple green apple pear flavor accented sweet toasty oak,15,-0.49914099853771093,-0.8476032790374707
742,1,0.05746219098077744,aurelio settimo lively dolcetto offer surprise twist form black fruit indian spice natural rubber overall effect rich cherry sweet fruit taste plush creamy close,21,0.07724629280233614,-0.13611094775761562
743,3,0.6517343837146344,pure cabernet sauvignon pretty ripe berry plum fruit flavor abundance toasty frame medium tannin hint dried leaf add overall composition nicely balanced limited production,12,0.07724629280233614,0.5428646368688258
744,3,-0.5368100017530796,comfortable old shoe grand estate chardonnay columbia crest delivers broad open flavor buttered fruit almost like biting slice apple pie crust hard argue case strong,15,0.2213431156373479,-1.430863679601894
745,1,0.35459828734770593,juicy round open scent honeysuckle yellow stone fruit hint aromatic herb full bodied offer ripe white peach pear hint candied lemon drop mineral note back finish,24,0.36543993847235967,-0.41585300824620924
746,0,-0.23967390538615105,second clos de la maréchale light fresh dusty texture tannin held suspension red plum cranberry flavor,66,-1.075528289877758,0.8905691773398207
747,3,-1.7253543872207935,pretty dark full bodied rosé extracted heavy cherry berry flavor considered elegant almost red could drink room temperature,77,-0.7873346442077345,-1.5765694367170668
748,0,0.35459828734770593,tight taut crisp need time bring true fruity character behind texture ripe green plum fresh apple cut lime juice still young could benefit month drink late,48,0.36543993847235967,-0.6613492978335797
749,1,0.6517343837146344,aroma brandied cherry crushed violet black pepper whiff exotic spice lead way round dole dried plum raisin nutmeg vanilla confectionary note alongside velvety tannin drink,72,0.2213431156373479,1.2919157110138475
750,3,0.05746219098077744,start light wild berry bramble flavor nicely balanced persists across pleasant milk chocolate flavor well integrated good acid varietal merlot pleasurable easy drinking,51,-0.06685053003267563,-0.34141587203976637
751,3,-0.23967390538615105,give fresh young pinot year mellow right jammy raspberry cherry citric sharpness need brief time knit together become seamless,66,-0.6432378213727227,0.40882833349540515
752,3,-0.23967390538615105,exquisite combine delicacy harmony enormously fruity spicy flavor fill mouth aroma suggest candied ginger tropical fruit vanilla wildflower flavor effusively fruity dry side refreshingly crisp acidity try asian pacific fusion food,32,1.0859240526474185,-1.2968273762284732
753,3,-0.23967390538615105,great price unoaked white smooth crisp mouthwatering acidity ripe flavor citrus fruit lemongrass mineral vanilla finish honeyed richness easy find production case,26,-0.2109473528676874,-1.2968273762284732
754,0,0.35459828734770593,pure strawberry jam ripe fruit scintillating freshness acidity also round tannin giving weight aftertaste deliciously fruity,28,-1.075528289877758,-0.7518880949754525
755,1,0.9488704800815629,la giaretta coming winery full evolution modern approach excellent pricing deep oak aroma thankfully overwhelm delicate note cherry cola cough drop indian spice herbal infusion almond spice driven velvety texture lively fruit finish,20,1.3741176983174421,-0.2701472511310363
756,2,-1.428218290853865,warm smelling menthol cough syrup sweet jammy berry fruit also fairly medicinal term feel bit hard underdeveloped turn tart herbal get know,89,-0.2109473528676874,-1.0571964510798075
757,3,0.6517343837146344,luscious long full bodied rich wonderful showcase appellation well ripened flavor blackcurrants cassis drink long deep although hollowness cost point flavor wrapped soft easy complex tannin fully dry nicely oaked immediately enjoyable,12,1.2300208754824302,0.40882833349540515
758,2,-1.1310821944869365,aroma barrel spice grilled pineapple solid thick creamy orange marmalade banana flavor like thick unctuous chard glob oak strong point taste much like cinnamon stick wood imported dreyfus ashby co,15,0.9418272298124067,-0.20178837871330557
759,3,1.2460065764484913,impress sheer volume fruit flamboyant tropical pineapple mango guava lot dusty spice rich oak manages hold onto balance dryness even sense finesse way long finish,15,0.2213431156373479,0.5852608212354656
760,3,0.9488704800815629,sweet meet earthy aroma recall grilled beet cola sassafras bottling come father son team tondré joe alarid planted vineyard combined nearly century worth farming experience salina valley homemade cranberry sauce win tannin pinot noirs similar age enjoy cellar even emerging flavor,66,2.526892280997536,0.626610078506277
761,3,-1.1310821944869365,nose volatile pruney color dark almost port like soft flat fruit seems waxy dead lightly pruney also bit green taste though half grape underripe half raisined,51,0.36543993847235967,0.2631225763802322
762,3,-0.5368100017530796,sharp lean side showing sour red cherry candy wintergreen green peppercorn flavor fattened sweet oak dry elegant rich drink,66,-0.6432378213727227,1.1783427152637203
763,3,-0.23967390538615105,massive could grown california sun show enormously ripe flavor red black currant cola red plum spice enriched significant oak particularly nuanced elegant due obvious power could age future uncertain,66,0.797730406977395,0.9250974075206609
764,3,1.2460065764484913,blend cabernet sauvignon cabernet franc merlot fruit sourced entirely conner lee vineyard superjuicy black cherry balanced generous acidity vibrant full long fresh could age gracefully decade,50,0.36543993847235967,0.1584284976948453
765,3,-1.7253543872207935,taste sweet cherry blackberry jelly flavor racy clean acidity like simple glass fast food restaurant,51,-1.2196251127127697,-1.9126045234463094
766,3,0.05746219098077744,rounded aroma melon salty peach rise nose monterey county appellation south santa lucia highland driven citrus grass rather extreme sense sea salt enhanced mouth watering acidity nectarine flesh finish tasty though varietally uncommon,83,1.3741176983174421,-0.13611094775761562
767,3,0.35459828734770593,pear apple orange earth bouquet set stage chockful pineapple pear lemon toast note offset vibrant acidity uplift fruit nicely finish long tart sweet complex leesy earthy note medium bodied restrained complex show depth give six month year unfold,15,2.0946018124925008,0.49936713063727806
768,3,-2.3196265799546505,soft medicinal uninteresting marked harshness green flavor barely suggest cherry,104,-1.9401092268878286,-1.2968273762284732
769,3,-1.428218290853865,sort second reverie rustic sharp tart jellied blackberry cherry flavor going anywhere,7,-1.651915581217805,0.626610078506277
770,3,-0.5368100017530796,nice slightly sweet white tropical fruit buttered toast white flower vanilla flavor easy drink cocktail sipper,46,-1.075528289877758,-0.34141587203976637
771,3,-1.428218290853865,soft semisweet honeyed lemon lime gatorade everyday white simple clean,83,-1.9401092268878286,-0.575455607235392
772,1,0.6517343837146344,sophisticated blend merlot cabernet sangioveto newly inaugurated frassinello winery designed architect renzo piano deeply etched oak tone blueberry forest berry close fresh crisp good length,72,0.2213431156373479,0.8193005564310913
773,1,0.05746219098077744,ripe fruit note black cherry raspberry followed chocolate delicate spice blend sangiovese merlot maremma tuscany sharp well focused mouth lingering tone ripe fruit crisp berry finale,72,0.36543993847235967,-0.13611094775761562
774,3,0.05746219098077744,bump price winemaker ups percentage new oak half fruit estate grown light clean well balanced drink like village burgundy right hint herb around tart red fruit,66,0.36543993847235967,-0.6613492978335797
775,1,0.05746219098077744,ripassá refermented skin produce extra richness intensity aroma distinctive offer tone blackberry jam currant clove curry powder luscious slightly sweet tasting chewy tannin,72,-0.06685053003267563,-0.6613492978335797
776,3,1.8402787691823483,ripe aromatic throwing cascade inviting scent new toasty oak dominates undercurrent blackberry jam blueberry mocha anise mouth huge lush powerful explosively fruity young yet maintains balance elegance really good best,12,0.9418272298124067,2.051285605810678
777,3,0.05746219098077744,rich toasty aroma barrel dominated aroma flavor vanilla sweet buttery oak underlying strong cherry balsam flavor girded considerable tannin pair game meat stew barbecue wrestle structural element submission,67,0.6536335841423832,0.626610078506277
778,3,0.05746219098077744,feminine soft gentle delicious feel light silky mouth rich note cherry raspberry cotton candy buttered cinnamon toast sandalwood almost sweet finish nice dry drink,66,0.07724629280233614,0.9250974075206609
779,3,1.5431426728154198,quilceda single vineyard bordeaux style blend cabernet sauvignon cabernet franc merlot petit verdot vineyard across road champoux dusty fragrant suggests soft leather toast caramel coconut hiding fruit first wash luxurious barrel flavor fruit emerges hour decanting tart racy mix berry sweet tomato,72,2.670989103832548,1.8670825248450613
780,3,0.35459828734770593,cabernet sauvignon vine planted went leonetti cab half evenly split merlot cab franc crafting mix herb earth moderate density nicely spiced brambly red fruit butterscotch coming finish,72,0.5095367613073715,0.8193005564310913
781,3,-0.5368100017530796,cab go dip age five may one little awkward structure sharpness feeling oak integrated ripe blackberry fruit could emerge fine couple year,12,-0.2109473528676874,0.7063660963742043
782,3,-0.23967390538615105,showing rich exotic side viognier ripe flamboyant flavor tropical fruit white flower spice controlled dryness citrusy acidity lovely versatile white,100,-0.49914099853771093,-0.20178837871330557
783,3,0.05746219098077744,meaty shiraz pull punch proudly displaying black raspberry earthy salumi infused flavor around rich dense texture full leather touch smoke temecula valley continuing make stride jumbo jet sized example finish teensy bit sweet shiraz blended cinsault,84,1.8064081668224774,1.1783427152637203
784,2,-0.23967390538615105,aroma black fruit light oak violet good basic pretty much defines rest expect easy flowing candied regular berry flavor front light medium finish nicely done approachable,52,0.36543993847235967,-0.9491228357574785
785,3,-1.1310821944869365,good color light cranberry fruit flavor strong mint streak running core hard find varietal character thin herbal bit hard edged,80,-0.49914099853771093,-0.13611094775761562
786,1,-0.833946098120008,truckloads fresh banana emerge nose backed vanilla bean chalky minerality vitamin like aroma somewhat dilute banana note put another strong appearance imported vias import,64,0.07724629280233614,-1.2968273762284732
