,country_encoded,points_scaled,description_clean,variety_encoded,length_scaled,price_scaled
223,3,1.2460065764484913,lovely soft charming far simple although complex layer cherry blackberry cassis cedar also show fine structure ripe smooth tannin supporting acidity drink fresh forward,7,0.07724629280233614,1.4238390048510892
224,3,-0.23967390538615105,land sweet side corral good texture tannin acidity well oodles grapy blackberry jam flavor complete package full bodied rich mouthfeel ripe fruit character stay finish,72,0.2213431156373479,-0.9491228357574785
225,3,0.05746219098077744,pure sémillon barrel fermented new american oak new spokane based winery sémillon make best white wine washington though consumer interest tepid show barrel influence rich coconut wrapped sleek fruit flavor white peach green apple hint cucumber,88,1.8064081668224774,-0.7518880949754525
226,3,0.05746219098077744,presently reined exotic element showing ginger saffron green apple bouquet well balanced lively apple citrus flavor good acidity firm structure hold together three four year aging may integrate develop,15,0.797730406977395,0.1584284976948453
227,3,1.2460065764484913,beautiful copper color deep dense modeled wine provence domaines ott rosé designed say winemaker age whole cluster fermented grenache vine picked grown specifically saignée compact compressed powerful emphasis mineral subtext light peach strawberry highlight,77,1.5182145211524538,0.40882833349540515
228,1,-0.833946098120008,hearty montepulciano abruzzo relatively hot offer load ripe jammy fruit plum prune backed exotic spice black peppercorn show solid dark tannin close,53,-0.2109473528676874,-0.9491228357574785
229,3,0.05746219098077744,perfumed floral intriguing still tight mountain tannin year thick black cherry pepper tone emerge becoming rounded note violet oaky leather,37,-0.49914099853771093,-0.2701472511310363
230,3,1.5431426728154198,ripe lush syrah boldly express shiny saturated color bright spicy assertive fruit full bodied sappy forward plump deep core blackberry fruit enhanced pepper citrus peel clove spice young still grapey delicious right cellared year,87,1.5182145211524538,0.5428646368688258
231,3,0.9488704800815629,softness rusticity almost always mark sierra foothill wine yet rise might called coastal elegance spanifornia blend tempranillo cab sauvignon complexity unfolds wave blackberry tobacco clove anise espresso drink,72,0.6536335841423832,0.8193005564310913
232,3,-0.833946098120008,young yeasty style best consumed early refreshes like light beer quick clean bracing acidity much way fruit,15,-0.9314314670427463,-1.1727291425892656
233,2,0.9488704800815629,never tried producer wine heap praise medium bodied modern style rioja bacon rubber raspberry work bouquet ripe full pump forth pure red fruit flavor firm mildly tannic ample new oak leaving lasting flavor vanilla coffee pepper hold another year possible case produced,90,2.670989103832548,-0.34141587203976637
234,3,-0.23967390538615105,fruity rich honey sweet decadent flavor peach pear jam apricot pineapple green apple vanilla enhanced sweet smoky oak good spine acidity balance,47,-0.2109473528676874,-0.20178837871330557
235,3,0.6517343837146344,syrah show intense blackberry crème de cassis plum sauce flavor plus hint charred bone black pepper dry tannin firm supple alcohol high balanced fruit,87,0.07724629280233614,0.8193005564310913
236,3,-0.23967390538615105,full bodied juicy offer wealth blackberry black cherry plum tobacco bacon pepper spice flavor housed thick tannin production case easy find,104,-0.3550441757026992,-0.6613492978335797
237,3,2.137414865549277,notable thing pinot intensity blend new dijon clone older california selection pinot noir stunning flavor raspberry cherry dr pepper balanced elegant vibrant texture need time truly shine hold till least,66,0.9418272298124067,1.4238390048510892
238,3,0.6517343837146344,nice oaky rich vineyard heart cool climate southern part russian river valley acidity star giving zesty balance ripe pineapple green apple key lime pie pear flavor new oak tune add opulent touch,15,1.2300208754824302,-0.34141587203976637
239,3,0.05746219098077744,new winery promising start decadently rich cassis cherry milk chocolate vanilla flavor structural integrity fine acidity soft tannin grip cherry skin oak add tannic complexity,12,0.2213431156373479,0.046749800602869554
240,3,1.8402787691823483,fermented whole cluster aged neutral oak offer complex expressive aroma green olive fresh herb grilled asparagus earth peat brings wave intensity sensuous layered savory flavor lead hyperextended finish exclamation point show promise young winery vineyard,87,1.6623113439874655,0.9920887340598284
241,3,-0.23967390538615105,lot bang buck offer mouth filling juicy blackberry cherry pomegranate coffee flavor bone dry soft fairly complicated tannin structure drink,51,-0.49914099853771093,-0.9491228357574785
242,3,-0.5368100017530796,ripe stuffed blackberry cherry cocoa also pretty tannic although sweet oak softens blow feel lush good rustic around edge drink beef dish,50,-0.2109473528676874,-0.8476032790374707
243,3,0.9488704800815629,open fresh liveliness stemmy earth black tea note growing funkier herbal midpalate brightly layered deeply flavored full bodied rendition remains true variety,66,-0.2109473528676874,0.40882833349540515
244,3,-0.23967390538615105,kind wildly popular cocktail sipper fruit spice oaky vanilla appeal almost palate yet dry crisp acidity leaving behind clean fruity finish,63,-0.3550441757026992,-0.8476032790374707
245,1,-0.5368100017530796,gravina appellation puglia southern italy charming blend greco malvasia open easy aroma pear golden delicious apple drying mineral talc powder tonic fresh mouth would pair tomato bruschetta fresh basil,102,0.797730406977395,-1.5765694367170668
246,0,1.2460065764484913,powerfully ripe toasty showing richness chablis adding layer structure go apple cream richness center green minerality,15,-1.075528289877758,1.9245016300797408
247,3,-0.5368100017530796,dry savory blend grenache blanc roussanne viognier tangy spine minerality frame lusher note papaya white peach lemon zest nectarine vanilla finish refreshing touch citrusy acid,74,0.2213431156373479,-0.20178837871330557
248,0,-1.1310821944869365,light fresh fruity attractive red berry plus acidity soft structure,7,-1.9401092268878286,-0.20178837871330557
249,3,-1.428218290853865,smell taste quite ripe softening resolving age year showing streak veggie green behind cherry,87,-1.3637219355477814,0.3616545144036777
250,3,1.2460065764484913,always dry elegant pinot noir signorello la amigas display quality show dried raspberry cherry cola flavor distinct minerality dusting tobacco black pepper fancy pinot natural lamb steak,66,0.5095367613073715,0.9920887340598284
251,3,-0.833946098120008,cola cherry mocha vanilla flavor light bodied silky pronounced acidity finish dry bit rustic offer good pinot character,66,-0.7873346442077345,-0.20178837871330557
252,1,3.028823154650062,paleo pure expression cabernet franc coastal tuscany drop dead gorgeous amazing intensity purity aroma get bright berry note drying mineral exotic spice cooling acidity firm satisfying structure rich velvety beautiful award memorable drinking experience year time,10,1.8064081668224774,2.5066548836053326
253,0,-0.23967390538615105,oxidative spicy effusive mineral note provide complexity turn heavy mouth without fruit balance crisp silky texture short medium finish,3,-0.6432378213727227,0.626610078506277
254,3,0.6517343837146344,dry chardonnay marked pronounced acid steely mineral underlying flavor exotic pineapple guava new oak lee aging add richer note buttered toast sour cream drink,15,0.07724629280233614,0.1584284976948453
255,1,0.05746219098077744,bright friulano luminous golden color intense aroma honey peach passion fruit taste soft supple mouth delivers load fruity peach flavor close nice delivers high structure lively fruit fragrance time,25,0.797730406977395,-0.6613492978335797
256,1,-0.833946098120008,oak dominates overall character forward note toasted wood tobacco leaf roasted coffee bean hint plum wood fruit,72,-0.9314314670427463,-0.4937535579628242
257,3,-1.1310821944869365,simple direct minty flavor blackberry licorice cola peppercorn vanilla plus side fully dry tannin smooth,12,-1.2196251127127697,-1.9126045234463094
258,3,0.6517343837146344,good price cab rich supple deep flavor blackberry pie filling milk chocolate anise sweet oak yet softly balanced dry delicious drinking,12,-0.3550441757026992,0.1584284976948453
259,3,0.05746219098077744,soft broadly fruity chardonnay near tropical ripeness banana papaya flavor dominate accented pretty baking spice touch mineral,15,-0.9314314670427463,0.2631225763802322
260,0,0.05746219098077744,somebody carried away wood totally dominated flavor burnt even new wood much said fruit could increase weight black berry flavor another three four year,44,0.07724629280233614,-0.20178837871330557
261,1,-0.23967390538615105,le focaie great value easy one dimensional fruit characteristic cherry blackberry cinnamon spice natural thickness consistency recall sunniest vineyard southern tuscany,80,-0.3550441757026992,-0.9491228357574785
262,3,1.8402787691823483,wild feral quality fine pinot noir forest flavor wild mushroom thyme fennel anise pine along familiar flavor red cherry cola sandalwood elegant ageable,66,-0.06685053003267563,1.6600835591081358
263,3,-0.23967390538615105,crushed stone dried clay note lend distinctly earthen character dry light bodied riesling pressed apple pear flavor freshened squirt lime lemon tart green plum finish finish long lingering,76,0.6536335841423832,-0.9491228357574785
264,0,-0.5368100017530796,weight structure almost overpowering fresh blackberry fruit presence big powerful bitter fruit black fig finishing final punch richness,7,-0.7873346442077345,-0.4937535579628242
265,3,0.6517343837146344,quite distinguished flamboyant aroma spicy blackcurrants cassis oaky overlay smoke vanilla feel good soon hit blackberry flavor last finish jolt dry tannin make puckery suggests midterm aging,12,0.5095367613073715,0.5428646368688258
266,3,0.35459828734770593,get extra year barrel prior release two third cabernet sauvignon syrah petit verdot still tart tannic carry full load herb earth characteristic less impact fruit high alcohol would suggest,72,0.797730406977395,0.9920887340598284
267,3,1.8402787691823483,unfortunately available bermuda wonderful bottling show salted brambleberries crushed violet asphalt rosemary pinpointed florality fresh yet concentrated nose zesty darkly focused elderberry stewed plum thyme earl grey tea quite complex effort,66,1.0859240526474185,0.3616545144036777
268,3,0.9488704800815629,captivating tread line rhône bordeaux splash cabernet though fraction blend stand depth persistence mix grape work well showing brambly red fruit like zin spice pepper like syrah herbal leafy tobacco finish complex unique quite appealing,72,1.6623113439874655,0.8193005564310913
269,1,-0.5368100017530796,fuss blend chardonnay fiano offer simple tone citrus pear segue crisp clean mouthfeel pair fresh southern italian white insalata di mare seafood salad,102,-0.06685053003267563,0.10351997739105015
270,0,-0.5368100017530796,medium intense note sweet grass fresh red apple slice green melon lime citrus nose mouth medium weight moderate supporting acidity clean finish drink,102,-0.06685053003267563,-1.5765694367170668
271,3,-0.23967390538615105,pure cabernet sauvignon heavy within sleek profile interesting flavor berry leaf earth tannin crisp proportionate fruit carry graceful moderately long finish,72,-0.3550441757026992,0.45470955519741424
272,2,-1.1310821944869365,aroma chocolate mint creamy vanilla candy reflect heavy handed oak treatment sweet burnt cherry chocolate mint character present throughout creamy tongue confected term flavor finish,89,0.2213431156373479,-0.6613492978335797
273,3,0.35459828734770593,ripe fleshy young fruit cab minor amount cab franc merlot show black currant plum cherry cedar flavor dry sweet dusting crushed brown herb spice fairly tannic tight balanced enough mid term aging best,12,1.3741176983174421,2.051285605810678
274,2,1.2460065764484913,early blast gaseous sulfur heavyweight tempranillo smell toasted oak graphite latex alcohol lush meaty jammy borderline syrupy flavor blackberry fig chocolate finish depth extreme richness drink,89,0.36543993847235967,2.1363069026224077
275,1,-0.23967390538615105,terre di maria sicilian blend cabernet sauvignon merlot syrah pinot noir open dark concentration savory aroma spice cured meat smoked bacon dark berry fruit bouquet slightly muddled mouthfeel bright fresh,72,0.9418272298124067,-0.012012714118408771
276,3,0.35459828734770593,intricate aroma spicy complex flavor make medium bodied adventure drink smell like cherry clove wood smoke taste nicely ripe dry appetizing tannic grip texture,4,0.07724629280233614,-0.8476032790374707
277,3,0.6517343837146344,eric hamacher done fine job alcohol fine balance precise mix strawberry pie cherry root beer herb flavor medium bodied open accessible simple reason wait could cellared six year,66,0.6536335841423832,0.8193005564310913
278,3,-1.1310821944869365,little sharp minty pinot dry acidic flavor cherry cola mouthfeel silky going anywhere drink,66,-1.3637219355477814,0.9250974075206609
279,3,-0.23967390538615105,hot high alcohol give burn accentuates pepper spice make fierce yet fully dry rich blackberry blueberry anise tobacco flavor defines california superripe zinfandel style,104,0.07724629280233614,-0.34141587203976637
280,0,-1.7253543872207935,firm dry tannin bitter extraction hard side juicy fruit balance,7,-1.9401092268878286,-0.4937535579628242
281,3,-0.5368100017530796,soft round explosive burst candied fruit barbera concentrated flavor dried cherry plum milk chocolate latter pop finish,4,-0.9314314670427463,-0.20178837871330557
282,0,1.2460065764484913,produced top year rich impressive great fruit ripe strawberry red currant bringing juicy fruitiness also serious mineral texture come tangy acidity age month drink end,77,0.2213431156373479,-0.7518880949754525
283,3,-0.833946098120008,rustic strong edgy tannin modest cherry coffee flavor dry astringent soften beef,87,-1.651915581217805,-0.20178837871330557
284,3,-0.833946098120008,ripe generously oaked chardonnay flavor pineapple jam buttered toast buttered popcorn brightened crisp acidity,15,-1.3637219355477814,-0.07291251034901033
285,1,-0.23967390538615105,dark berry truffle toast kitchen spice aroma meld glass note roasted coffee bean powdered sage ground pepper accent core dried black cherry assertive tannin provide framework end astringent note,72,0.797730406977395,-0.575455607235392
286,3,-1.428218290853865,earthy spicy aroma lead rolling smoky layer typical cab flavor berry tobacco touch sweet oak give okay complexity,12,-0.7873346442077345,-0.8476032790374707
287,1,0.35459828734770593,rubesco riserva dark sophisticated blend sangiovese canajolo big aroma red fruit exotic spice exceptionally hot year show extra ripeness fruit touch bitterness close,72,-0.06685053003267563,1.1487037143524497
288,0,-0.23967390538615105,toasty note slightly menthol like oak layered ripe blackberry fruit medium bodied finish crisp tart mouthwatering give another month better integrate oak drink next five year,45,0.36543993847235967,-0.8476032790374707
289,0,0.9488704800815629,generous opulent wood aged fruit play delicious part blackberry juice acidity play counterpoint toasty wood flavor dark tannin fine toasty aftertaste promise good aging drink,7,0.2213431156373479,-0.4937535579628242
290,0,0.35459828734770593,clerc milon winemaking team mouton rothschild attractive heavy already quite soft seems heavily extracted new world style new wood aroma flavor losing something pauillac winner immediately attractive imported diageo chateau estate,7,1.0859240526474185,1.1487037143524497
291,1,-0.23967390538615105,open aroma dark berry toast espresso whiff dark cooking spice bracing offer unripe cherry licorice powdered sage toasted oak alongside bracing tannin leave astringent mouth puckering finish,56,0.5095367613073715,0.10351997739105015
292,3,1.8402787691823483,venge taken giant leap front rank california syrah producer made fruit sourced great stagecoach vineyard straddle atlas cool mountain region acidity preserved concentrated fruit easily handle new french oak dramatic high alcohol selection gorgeous drink remain fresh next six year,87,2.3827954581625246,1.1185306487467348
293,0,0.6517343837146344,ripe open packed melon tropical fruit flavor already showing enticing drinkability fresh ripe fruit layered mineral character cushion wood,15,-0.6432378213727227,1.4238390048510892
294,3,1.2460065764484913,dark rich ripe syrah defines california style preserve fine structure cool climate region lends red wine dry tannic flavor blackberry cherry blueberry dark chocolate sweet smoky oak delicious year,87,0.797730406977395,-0.012012714118408771
295,3,-0.23967390538615105,brander struggled merlot year bottling achieve plenty cherry berry mocha fruit challenge continues tannic structure improvement notable,51,-0.9314314670427463,-0.4937535579628242
296,0,-0.5368100017530796,excellent color firmly fruity attractive edge tannin giving good structure showing fresh nouveau fruit,28,-1.3637219355477814,-1.2968273762284732
297,1,-1.1310821944869365,cantina tre serre well priced informal barbera thin informal style backed fruity freshness even tiny touch effervescence add perky peppery sensation mouthfeel,4,-0.2109473528676874,-1.430863679601894
298,0,0.9488704800815629,solidly structured show firm tannin mineral structure typical wine côte du py dense black cherry fruit along sacidity cut structure could age another year worth drinking,28,0.36543993847235967,-0.20178837871330557
299,3,0.05746219098077744,year value red blend surprisingly different syrah main component spicier sappy loaded bright forward berry flavor bordeaux grape fill second half blend add note herb earth leaf hint stone delicious fine value,72,1.2300208754824302,-0.9491228357574785
300,3,1.8402787691823483,cabernet sauvignon balance malbec petit verdot merlot offer brooding well delineated aroma flavor blackberry dried flower black tea herb earth barrel spice light meaty note packed tightly firm tannin also show great length drink,7,1.5182145211524538,2.8097467472150255
301,3,0.05746219098077744,sweet pea vine green herb add freshness perfumed flower luscious peach nectar note classically styled pinot gris dry yet mouthfilling rich finish long note stone fruit black tea leaf,65,0.797730406977395,-1.0571964510798075
302,3,0.05746219098077744,rounder fruity inaugural pinot gris succulent green apple bosch pear flavor balanced crisp refreshing acid,65,-1.2196251127127697,-0.9491228357574785
303,3,1.5431426728154198,one wish mike januik made riesling made bacchus vineyard fruit excellent made bright spicy pleasing style offer lively flavor citrus orange pear hint mint splash jasmine tea engaging long refreshing finish add pleasure,76,1.3741176983174421,-0.4937535579628242
304,3,0.9488704800815629,best new release michael florentino changed hand since harvested autumnal flavor marry vivid distinctive fruit hint leaf citrus elegant complex,54,-0.49914099853771093,-0.13611094775761562
305,3,1.5431426728154198,nice held back year releasing beginning meld together delightful way tannin oak alcohol coalescing cherry pomegranate cola tangerine vanilla spice giving silky complex mellow mouthfeel beautifully dry lush develop,66,0.797730406977395,0.8193005564310913
306,3,-0.5368100017530796,give tough young cabernet good long decant serving first dominated sharp acidity mouth numbing tannin airing offer black currant flavor likely ager,12,-0.2109473528676874,0.9920887340598284
307,0,0.35459828734770593,intriguing offer ripe sweetness followed edgy rustic acidity stage evolution probably tannin promise aging intensely aromatic nature fruit point potentially fine drink yet,66,-0.06685053003267563,1.1487037143524497
308,3,-0.833946098120008,get case make house easy drinking dry spicy enough cherry berry cola flavor satisfy tastebud,51,-1.2196251127127697,-1.5765694367170668
309,1,0.05746219098077744,cherry citrus rind oak make short stout nose seems precise pure cherry coffee flavor poking veil tight tannin get even firmer finish smack raisin requires airing cellar time,7,0.6536335841423832,0.1584284976948453
310,3,-0.833946098120008,smooth ripe bordeaux blend pleases rich array blackberry cherry spicy plum flavor texture soft chocolaty loses point two sugary finish though drink,7,-0.2109473528676874,0.626610078506277
311,3,0.9488704800815629,great tax santa barbara bottling great value really delivers offering dry elegantly structured complex silky texture house savory flavor cherry red currant cola sandalwood umami bacon delicious drinking,66,0.6536335841423832,-0.2701472511310363
312,3,-0.23967390538615105,bone dry aroma freshly pressed apple austere elegant sparkling blend chardonnay pinot noir note delicate white florals yeast backdrop savory dusty quality accented racy acidity strong minerally finish,14,0.6536335841423832,-0.13611094775761562
313,3,-1.428218290853865,bit rough ready show basic cabernet quality full bodied flavor blackberry currant chocolate smoky oak good tailgate party,12,-0.7873346442077345,-1.1727291425892656
314,3,0.05746219098077744,nice ripely sweet fresh blackberry cherry oak flavor syrah made drinking dry rich tannin soft velvety mouthfeel show interesting complication smoked meat pepper cola mineral,87,0.2213431156373479,1.1185306487467348
315,3,1.2460065764484913,von strasser good track record right best forewarned tannic diamond mountain give good year least throw sediment let rich blackberry black currant flavor emerge hold well year,12,0.5095367613073715,1.6600835591081358
316,3,-0.23967390538615105,fan ripe modern style chardonnay fall love bottling strong toast buttered popcorn vanilla cream peach pear pineapple jam flavor dazzle wow easy find nearly case produced,15,0.36543993847235967,-0.34141587203976637
317,3,-1.1310821944869365,straightforward chard show well ripened flavor pineapple jam nectarine peach vanilla finish caramelized butterscotchy sweetness,15,-1.2196251127127697,-0.6613492978335797
318,3,-1.7253543872207935,unbalanced lot acidity hard tannin raisiny flavor alongside green one,104,-1.9401092268878286,-0.012012714118408771
319,3,0.9488704800815629,nice syrah dark dry full bodied although bit young thick jammy primary fruit flavor smooth balanced rich blackberry pie chocolate violet beef carpaccio bacon pepper flavor develop,87,0.5095367613073715,0.3616545144036777
320,3,-1.1310821944869365,fruity easy soft sweet flavor apricot caramel valdiguié formerly known napa gamay red grape account note crushed raspberry,101,-0.7873346442077345,-0.7518880949754525
321,1,1.5431426728154198,beautifully extracted voluptuous barolo cannubi cru would pair tender veal shank slow cooked falling bone black cherry spice root beer fragrant earthy tone appear nose close tight firm structure cellar age ten year,56,1.3741176983174421,2.051285605810678
322,3,2.137414865549277,bordeaux blend based cabernet sauvignon merlot grape stunning came david abreu vineyard st helena foothill complex softer open approachable colgin cab flamboyant spectrum cherry framboise cocoa violet gingerbread spice framed supple fine tannin beautiful feminine great beauty drink,7,2.0946018124925008,3.4850216456165852
323,1,-0.833946098120008,pale luminous rosé southern italy pinkish peach color delicate aroma stone fruit wild berry white cherry touch chopped mint basil tart also slightly sweet mouth touch bitter almond close,77,0.797730406977395,-0.9491228357574785
324,2,-0.5368100017530796,full roasted earthy nose coconut berry aroma sweeten thing tight level structured mouth roasted raspberry plum along oaky buttery smoky accent confirm roble designation good excess oak process,89,0.6536335841423832,-0.6613492978335797
325,1,-0.5368100017530796,absolutely terrific informal sparkling rosé southern italy made negroamaro grape sweet berry chopped mint peach come fore soft slightly sweet easy fresh would make great cocktail choice,57,0.5095367613073715,-1.5765694367170668
326,2,0.35459828734770593,dark sweet candied nose hint raisin licorice become prominent mouth saturated also somewhat monotone single leveled term get narrow band sweet black cherry raisin front short finish nice always best allende reviewed,89,1.2300208754824302,-0.07291251034901033
327,3,-1.1310821944869365,although ste michelle widely available merlot offering break mold held back considerable time prior release unusual scent overripe raisined fruit streak tobacco black licorice soft midpalate bitterness finishing tannin,51,0.797730406977395,-0.8476032790374707
328,0,-2.0224904835877218,dilute grapey flavor candied pile charred lumber make go easier simple wood juice quaff,87,-1.3637219355477814,-2.109839264228336
329,3,0.9488704800815629,lovely zinfandel soft appealing fine balance dry rich cherry currant provençal herb spice tobacco flavor show real complexity change glass,104,-0.49914099853771093,-0.13611094775761562
330,3,-1.7253543872207935,hot unbalanced fruit flavor span gamut raisin mint zin bone dry rustic rugged tannin coarse finish,104,-1.075528289877758,-0.7518880949754525
331,3,-0.5368100017530796,amador foothill good job sangiovese dry rosé made variety cheerful brisk acidity delicate complex cherry rose petal lavender flavor winemaker recommends bouillabaisse pretty good suggestion,80,0.2213431156373479,-1.430863679601894
