,country_encoded,points_scaled,description_clean,variety_encoded,length_scaled,price_scaled
448,3,-0.5368100017530796,ripe sun enriched blackberry cherry mocha flavor rich sweet dusty tannin finish polished gentle cab little sweet oaky drink,12,-0.6432378213727227,-0.20178837871330557
449,3,1.2460065764484913,cabernet age dry richly flavored classic varietal flavor blackberry black currant cedar finely ground intense tannin youthful immaturity simply ready appreciate really need time part mesh together give develop complexity another year,12,1.2300208754824302,2.1363069026224077
450,0,-1.7253543872207935,bizarrely perfumed taste like candy shop smell note fruit jelly tannin taut hang together,7,-1.3637219355477814,-0.575455607235392
451,3,-1.428218290853865,box simple direct pineapple lime peach flavor sugary sweet crisp clean acidity box equivalent four regular bottle,102,-0.9314314670427463,-0.4937535579628242
452,3,0.6517343837146344,muscat canelli muscat giallo fragrant inviting exactly proclaims slightly sweet honeysuckle citrus crisp texture offer lightness lingering acidity moderate alcohol package,55,-0.3550441757026992,-0.8476032790374707
453,3,0.05746219098077744,aged american oak mostly similar vineyard source american oak spice fruit less smoothness overall c est belle bottling cherry berry flavor abound sturdy solid well made case produced,87,0.6536335841423832,0.40882833349540515
454,0,1.5431426728154198,complexity burgundy vineyard next familiar le charmes dessus meaning vineyard give mineral character hinting chablis meursault richness well hold delicious vanilla flavor ready year,15,0.07724629280233614,1.522370942874536
455,3,-2.3196265799546505,porty dull almost undrinkable except decent berry currant flavor,89,-2.0842060497228405,-0.34141587203976637
456,1,-0.23967390538615105,smell like ripe peach hint anise almond taste similar plump mouthfeel carry flavor across short pleasant finish nice apéritif mildly flavored fish poultry,19,-0.06685053003267563,-0.2701472511310363
457,1,1.2460065764484913,mostly cabernet sauvignon smaller percentage alicante petit verdot render soapy herbal nose accent root beer exotic spice lavender potpourri green pepper corn well balanced,72,0.07724629280233614,1.1487037143524497
458,3,0.6517343837146344,dry fairly tannic severe first sip hard appreciate although good black cherry cola leather oak black pepper flavor complex way get better breathes glass give good long decanting drink blend mourvèdre grenache syrah counoise order,73,1.6623113439874655,1.1487037143524497
459,2,-0.5368100017530796,waxy nose buttercup creamy yellow fruit scent white flower wet racy touch like soda sweet candied flavor peach melon plod along good enough acidity support core sweetness candied quality,15,0.797730406977395,-0.9491228357574785
460,2,0.35459828734770593,start rustic leathery hint smoke leafiness earth along baked berry spice four grape good density mouthfeel frame leather earth slightly baked berry fruit flavor finish chocolaty sweet enough acidity maintain balance,72,1.0859240526474185,-0.9491228357574785
461,3,0.05746219098077744,wonderfully dry minerally sauvignon blanc set crisp acidity rewarding flavor lemon grapefruit lime enriched pineapple fig honeysuckle,83,-0.9314314670427463,-1.2968273762284732
462,3,-0.23967390538615105,firm bit astringent dry ripe flavor blackberry currant black cherry cedar solid cabernet raw edge might age year,12,-0.7873346442077345,0.5428646368688258
463,3,1.8402787691823483,dripping earth kir fresh raspberry stellar heart appellation estate grown four acre spot planted trio clone spirited refreshing dance acidity floral back note compelling wrapped cinnamon mocha,66,0.5095367613073715,0.7063660963742043
464,3,-1.428218290853865,hallmark viognier namely lot tropical fruit wildflower vanilla spicy aroma flavor finish thoroughly dry could use brightness zest though bit flat,100,-0.3550441757026992,-0.20178837871330557
465,1,0.05746219098077744,smokey tone charcoal dark granite slate rise nose lazio based petit verdot dusty mineral note followed dark ripe fruit long lasting penetrating close,62,-0.06685053003267563,-0.20178837871330557
466,3,-0.23967390538615105,kind tough mouth time aggressive tannin effectively bury blackberry flavor also streak hung meat smoky leather add dimension best let soften year,104,-0.2109473528676874,-0.07291251034901033
467,1,0.9488704800815629,difficult understand specific philosophy behind light elegant ethereal blend nero avola frappato aged terracotta amphora studied attempt present pure product nature allows offer load bright fruit wild berry earth spice impressive complexity,72,1.2300208754824302,0.626610078506277
468,1,0.05746219098077744,oak aged chardonnay northern italy offer bright intensity peach melon yellow flower backed elegance toast roasted nut creamy soft mouth bitter almond note close,15,0.07724629280233614,0.1584284976948453
469,3,0.05746219098077744,defines style entirely separate napa rustic dry creek tannin even briary edge blackberry cherry totally dry well made elegant,12,-0.6432378213727227,-1.1727291425892656
470,3,0.6517343837146344,oaky ripe powerful tropical pineapple kumquat mineral floral aroma flavor new oak add smoke vanilla char bottom line flavorful acidic elegant chard lingering spicy finish,15,0.2213431156373479,0.046749800602869554
471,2,-0.23967390538615105,smooth ripe smelling clean berry aroma cherry plum pepper lead flavor feel tangy zippy clampy exceedingly fresh lot richness depth body pure clean common appeal,89,0.2213431156373479,-1.0571964510798075
472,3,0.05746219098077744,single barrel made pure sangiovese candy mountain vineyard tight tart dark capture black cherry fruit black licorice whiff smoke point time tannin acid seem fighting control,80,0.36543993847235967,0.9920887340598284
473,3,-0.5368100017530796,something like cross silky pinot noir soft merlot gentle fruity berry tobacco cola spice flavor nice scour tannin suggests pair rich oily meat cheese,80,0.07724629280233614,-0.8476032790374707
474,3,-0.23967390538615105,simple cherry fruit delicately earthy base defines everyday merlot keep herbal component check balanced appropriately rather light fruit,51,-0.7873346442077345,-0.6613492978335797
475,3,-1.428218290853865,date tar note come nuanced funky sweat like feel lax attack taste bit thin firm upper lip grabbing tannin mark finish,51,-0.3550441757026992,-0.07291251034901033
476,0,0.05746219098077744,certainly tannic tough moment also much fruit allow round bringing black currant fruitiness resulting full rich perfumed wait,7,-0.7873346442077345,-0.20178837871330557
477,3,0.35459828734770593,crisp refreshing note grated ginger white flower cantaloupe dry riesling balance peachy fruit flavor steely backbone slate lime tart acidity pleasantly long finish lovely around,76,0.2213431156373479,-0.8476032790374707
478,3,-1.7253543872207935,light generic sort low priced merlot california crank boatload washington better spiffy new label beef,51,-1.2196251127127697,-1.736172035706249
479,3,-1.1310821944869365,intense blueberry blackberry note penetrate fruity forward pinot noir hint savory herb add elegance otherwise one dimensional finish big coarse tannin,66,-0.3550441757026992,-0.34141587203976637
480,3,-0.833946098120008,easy like crisp mouthwatering acidity flavor lemon lime fig vanilla nice everyday drink roast chicken cocktail sipper,65,-0.9314314670427463,-0.575455607235392
481,0,-0.833946098120008,tobacco fresh raspberry aroma light perfumed smoky fragrant cabernet franc touch blueberry tannin intense burst finishing acidity,7,-0.9314314670427463,-1.0571964510798075
482,3,0.6517343837146344,chelan region washington newest ava already showing great potential syrah aromatic explosively flavorful prof ripe berry plum cherry swept mix smoke rock iron filing citrusy acid hint resin tar keep adding nuance,87,1.2300208754824302,-0.012012714118408771
483,0,0.9488704800815629,well structured balanced giving tannin well acidity balance fruit move direction sweet plum hint coffee vanilla spice texture promise aging also delicious juicy character,66,0.07724629280233614,1.1487037143524497
484,3,-0.5368100017530796,huge flavor jammy blackberry cherry dominate syrah coating sweet caramelized oak yummy especially complex drink,87,-1.2196251127127697,-0.07291251034901033
485,3,-1.7253543872207935,thick soft simple sweetish medicinal flavor cherry black raspberry lifesaver oak add vanilla,51,-1.5078187583827933,0.10351997739105015
486,3,-0.5368100017530796,ripeness blessing challenge super fruit jammy blackberry blueberry currant cherry brightened famous edna valley acidity surface without much complexity drink,87,-0.49914099853771093,-0.20178837871330557
487,1,0.05746219098077744,lush concentration deep aroma dark fruit black cherry make excellent first impression dolcetto show dark deep color chewy almost inky texture,21,-0.3550441757026992,-0.4937535579628242
488,3,1.2460065764484913,nice chardonnay dusty herbal tug napa chard often display otherwise rich potent pineapple pie peach tart flavor enriched creamy lee buttery new oak drink,15,0.07724629280233614,1.54612396290951
489,1,-0.833946098120008,lightweight thin mouth zesty white good job keeping refreshed quenches thirst think hot summer day easy informal stay focused simplicity,64,-0.49914099853771093,-1.0571964510798075
490,0,1.2460065764484913,old vine produced superconcentrated ripe note toast spice yellow fruit well bright acidity structure depth density age well year,83,-0.6432378213727227,0.40882833349540515
491,3,-0.5368100017530796,nose blend syrah cabernet franc merlot malbec petite sirah touch funky sour blackberry charcoal dried meat aroma charred blueberry sour black plum savory meat flavor show,72,0.36543993847235967,0.2631225763802322
492,3,-1.1310821944869365,rush zippy fresh fruit spice aroma recommends white new york offering kind clean fruit flavor minerality make region unique lack real complexity tends toward austere beguiling spice save day,15,0.797730406977395,-0.6613492978335797
493,3,-0.23967390538615105,soft sweetly fruity pie filling flavor blackberry plum cherry spiced anise cinnamon easy like drink,7,-1.2196251127127697,0.9250974075206609
494,3,1.2460065764484913,know rhône style wine saxum probably paso roble expensive nearly identical mostly syrah grenache decadently rich milk chocolate blackberry jam sweet smoky oak flavor high alcohol unless extremist regard help knocked sensuous pleasure,73,1.3741176983174421,2.051285605810678
495,3,-0.5368100017530796,bit soft overripe side currant licorice cherry cocoa oak flavor dry tannin fancy drink fresh grilled steak,12,-0.9314314670427463,-0.4937535579628242
496,3,2.137414865549277,beautiful confirms high level quality pinot noirs dan goldfield steve dutton profusion ripe black cherry currant flavor backed firm acidity fine grained tannin giving grip balance concentrated fruit flavor solid structure indicates long life cellar best,66,1.8064081668224774,1.2360918805832828
497,3,-0.833946098120008,rich bounteous flavor crushed ripe blackberry blueberry dill black pepper dark chocolate firm furry tannin bit bitter might age couple year,87,-0.3550441757026992,0.9250974075206609
498,3,-0.833946098120008,aroma vanilla wood spice lead elegant somewhat dried dilute fruit flavor followed short finish,12,-1.3637219355477814,-0.012012714118408771
499,3,1.5431426728154198,collaboration sonoma county based winemaker jesse katz ken forrester south africa varietal red robust rich dark cherry red currant integrated oak flavor support bold body,12,0.2213431156373479,2.1363069026224077
500,3,1.2460065764484913,extraordinarily rich pinot fat opulent cherry compote mocha root beer flavor generously oaked offer spicy oak note velvety texture big fruit forward manages maintain delicacy harmony throughout best,66,0.6536335841423832,0.9250974075206609
501,0,1.8402787691823483,relatively tight closed stage freshness poised rich fruit structure suggests long term development wood quite prominent overshadowing delicious yellow fruit flavor come back year magnificent,15,0.2213431156373479,2.294401568294713
502,3,0.6517343837146344,pinot noir based blend quite good dry red sophistication elegance soft approachable cherry fruit flavor complexed herb sage thyme rich earthiness,72,-0.3550441757026992,-0.13611094775761562
503,3,-0.833946098120008,easy drinking dinner dry balanced smooth tannin plum blackberry coffee flavor rich blueberry muffin finish,51,-1.2196251127127697,-0.8476032790374707
504,1,-1.428218290853865,catch eye brassy hue also make mark overtly sweet nose peach blossom melon mouth however struggle bit offering cider melon flavor soft rather punchless,35,0.07724629280233614,-1.1727291425892656
505,2,0.6517343837146344,cool nose tree bark tobacco aroma come together well tannic stout punishing roasted black fruit backing espresso bitterness show syrupy side also raw power drink,89,0.2213431156373479,0.7824955620174916
506,1,1.2460065764484913,beautifully executed fine aroma cola red currant licorice blue flower moist earth texture long smooth silky elegant texture touch menthol finish,56,-0.3550441757026992,1.1783427152637203
507,3,-0.23967390538615105,still dependable despite change ownership winery delivers elegant well made veers toward herbaceous note fruity one dominant flavor green olive sweet bell pepper think however lean oak provides fatness right food like grilled red meat coax berry sweetness,12,2.0946018124925008,-0.34141587203976637
508,3,0.05746219098077744,sweet residual sugar powerful flavor apricot honey orange vanilla bit soft luscious sweetness make work,15,-1.2196251127127697,-0.13611094775761562
509,2,-0.833946098120008,mild peachy aroma friendly nothing serious intense varietal macabeo feel citrusy lightly bitter flavor almond skin citrus pith green melon finish simplicity note nectarine,43,0.07724629280233614,-1.736172035706249
510,0,0.9488704800815629,ame mean spirit soul alain rotier belief express true nature gaillac estate basis place great perfume coming wood well chunky black fruit relatively soft concentration dense fruit rather tannin,22,0.797730406977395,0.626610078506277
511,3,0.9488704800815629,bone dry plenty acidity tough tannin offering much relief despite evident core blackberry currant cherry tannin really lock like sandpaper straitjacket tongue consider origin yountville cool area noted ageable wine hould begin resolve difficulty,12,1.5182145211524538,0.9920887340598284
512,1,0.35459828734770593,packaged modern screwcap friendly blend ribolla gialla smaller percentage friulano riesling delivers bright golden color lively fruit aroma stone passion fruit crisp lively mouth perfectly capture spirit winemaking northeast italy,102,0.9418272298124067,0.3616545144036777
513,3,-1.1310821944869365,bit raw rustic texture briary green peppercorn mouthfeel scoury tart acid couple berry cherry fruit zin taste sweet sour zinny wash barbecue ease,104,-0.06685053003267563,0.046749800602869554
514,3,0.05746219098077744,appeal broadly many pinot lover soft lush array raspberry cherry red currant licorice bacon lead long spicy finish trade complexity immediate appeal drink,66,-0.06685053003267563,0.9920887340598284
515,3,-1.7253543872207935,heavy soft like melted mocha raspberry sundae lack structure make sweet,12,-1.796012404052817,-1.5765694367170668
516,3,-0.23967390538615105,birch creek vineyard provides fruit stainless steel fermented aged offer note custard lee herb clover flavor show richer feel concentration seem trailing toward finish,88,0.07724629280233614,0.45470955519741424
517,1,-1.1310821944869365,almost stewy totally top nose offer earth oak brightness herb infused berry tomato fairly classic style fresh desirable,80,-0.7873346442077345,-0.4937535579628242
518,3,0.9488704800815629,dry little earthy dusty hay dried straw quality tangerine sweet lime lychee peach cream flavor interesting crisp chard plenty nuanced complexity,15,-0.3550441757026992,0.1584284976948453
519,3,-1.428218290853865,smell taste ungenerous probably due unripe grape give earthy vegetal going anywhere drink,72,-1.5078187583827933,-0.20178837871330557
520,3,-0.5368100017530796,nice rugged mountain zin briary brambly tannin peppery wild berry freshly picked vine alcohol add heat structure time barrel softened tannin might perfect backyard barbecue red,104,0.36543993847235967,-0.8476032790374707
521,0,1.5431426728154198,moody complex brooding superb exceptional value purple violet black forest cake cocoa nib espresso granule abound nose backed dark juicy black raspberry full firmly structured mouth note pepper tea smoked meat black fruit,87,1.3741176983174421,0.046749800602869554
522,2,0.9488704800815629,real surprise right mind could expect much quality cab franc tempranillo blend penedès try guarantee going like nose meaty ripe round feature pure core fruit backed chocolaty warmth kick well subtlety bargain hunter dream imported grape spain,72,1.950504989657489,-1.2968273762284732
523,3,-0.5368100017530796,another good job relatively inexpensive white variety clos du bois lake sonoma county grape show good sauvignon blanc character dry crisp savory lemongrass grapefruit peach flavor lightly oaked,83,0.6536335841423832,-1.0571964510798075
524,3,-0.833946098120008,touch oak influence lends smokiness lime meyer lemon tropical fruit flavor crisp acidity creates sweet sour drinking cocktail sipper ham chinese food,83,-0.2109473528676874,-0.9491228357574785
525,3,0.05746219098077744,tasty loaded fleshy fruity dominant note fresh cut pear dappled cinnamon spice round balanced delicious slight hint residual sweetness,65,-0.6432378213727227,-0.8476032790374707
526,3,-2.0224904835877218,nice aroma pie crust red fruit barnyard lead tart simple watered flavor red berry,10,-1.3637219355477814,-0.4937535579628242
527,3,-0.833946098120008,bold densely structured vanilla cream orange soda pineapple custard flavor good acidity appeal modern style ripe straightforward feel,15,-0.7873346442077345,-0.13611094775761562
528,3,0.35459828734770593,another lovely gewurz navarro made neutral oak fermentation rich crisp spicy mélange exotic fruit wildflower flavor,32,-1.075528289877758,-0.575455607235392
529,3,-1.1310821944869365,dry flavor ripe lemon lime vanilla accented brisk acidity simple pair well sweet chinese vietnamese food price right,83,-0.7873346442077345,-1.2968273762284732
530,3,-0.5368100017530796,pretty good pinot noir dry elegantly constructed crisp acidity backbone tannin flavor raspberry cherry fruit delicious texture scoury little warm even though alcohol relatively low,66,0.2213431156373479,0.1584284976948453
531,3,0.05746219098077744,polished sophisticated lush green apple pineapple buttered toast cinnamon flavor likeable balance sheer drinkability,15,-1.3637219355477814,-0.4937535579628242
532,1,1.5431426728154198,young vintner giovanni abrigo treiso area lovely expression barbaresco immediate aroma cherry cassis spice smoke leather tobacco approachable also built last natural concentration bright fruit flavor acidity hold ten year,56,0.9418272298124067,0.40882833349540515
533,2,1.5431426728154198,rooty earthy smelling aroma leather cassis tobacco dried cheese cola feel rich nicely textured firm friendly tannin set tobacco coffee mocha roasted berry flavor chocolaty uncanny way finish drink,89,0.797730406977395,1.54612396290951
534,1,0.9488704800815629,without doubt one successful vineyard crus barbaresco rabajà delivers unique intensity sophistication notice aroma black fruit spice tar licorice good balance acidity tannic structure pair roasted pork stuffed prune,56,0.797730406977395,1.056502822944859
535,0,-1.7253543872207935,michel laroche branching chablis recent year southern french effort chlorine note along aroma mint sweet wood power suppleness match pulsates finish dark sharp burnt,51,0.07724629280233614,-2.109839264228336
536,3,1.2460065764484913,like almost reverie cabernet release one need time cellar tasted fall tight grapey blackberry jam flavor girded firm stony minerality sweet hard tannin give year,12,0.2213431156373479,1.6600835591081358
537,3,-0.23967390538615105,pure mourvèdre begin well offering full varietal flavor built upon mix citrus ripe tree fruit along accent leaf forest turn soft seems bit overripe running rather short finish,54,0.6536335841423832,0.40882833349540515
538,3,-0.23967390538615105,bone dry crisply acidic ultraclean sauvignon blanc lemongrass lime grapefruit flavor savory bright accented cold streak stony mineral,83,-0.7873346442077345,-0.4937535579628242
539,1,-0.833946098120008,simple fruity nero avola offer fleeting blackberry tart red cherry flavor alongside fresh acidity pair pizza everyday informal meal,58,-0.6432378213727227,-1.1727291425892656
540,1,-1.1310821944869365,sub brand riunite albinea canali ottocentonero show simple easy line raw fruit cherry almond paste dry lambrusco without bitterness sometimes encounter wine,42,-0.2109473528676874,-1.1727291425892656
541,3,-1.1310821944869365,bottling ripe quite good cool harvest yielded somewhat green grapefruit gooseberry flavor veer feline territory,83,-1.2196251127127697,-0.4937535579628242
542,3,0.35459828734770593,aroma lemon soil flower quite subdued flavor restrained impressive balance variety often burly tannin well tamed,62,-1.075528289877758,0.2631225763802322
543,3,-0.23967390538615105,coming cool climate cab opulent ripe say napa wintergreen mint note alongside sweet red cherry black raspberry flavor lightly elegant weight different kind cab dry good one friendly food,12,0.797730406977395,0.40882833349540515
544,3,-1.428218290853865,lot ripe jammy cherry blackberry chocolate fruit easy drinking cab show rusticity though raisiny finish astringency tannin,12,-0.9314314670427463,-1.0571964510798075
545,2,-1.428218290853865,aroma milk chocolate covered cherry forced oak smell overtly sweet candied feel choppy juicy red fruit flavor buttery oak background turn sweeter buttery finish offer much complexity,39,0.5095367613073715,-0.9491228357574785
546,1,-0.23967390538615105,sangiovese merlot added softness dimension boast pretty note cherry blue flower toasted almond exotic spice nice elegance overall bit compact mouth,80,-0.3550441757026992,-0.9491228357574785
547,1,-0.5368100017530796,luminous pinot grigio open simple aroma stone fruit melon citrus delivers fine level acidity enough structure carry forward fish pasta risotto performs nicely mouth thanks creamy texture,64,0.5095367613073715,-0.4937535579628242
548,3,2.137414865549277,tannic closed vine cliff magnificent array cabernet hard bite acidity take much richness explode blackberry black currant dark chocolate butterscotch sweet cinnamon spice list go rich decadent enjoy gather momentum next year,12,1.2300208754824302,2.8097467472150255
549,2,-1.1310821944869365,mild salinic aroma bring lime lychee feel standard smooth enough sweet white fruit flavor suggest peach semi dry always feel taste sugary,85,-0.2109473528676874,-1.736172035706249
550,2,-0.5368100017530796,fresh berry aroma carry spice note rugged little hot juicy berry flavor forward overly evolved complex finish tight aggressive spunky clean honest flavor,95,-0.06685053003267563,-1.0571964510798075
551,0,0.35459828734770593,month new wood aging still wood toast weight promise blackberry fruit firm tannin finely structured mature well,7,-0.9314314670427463,-0.6613492978335797
552,3,-1.1310821944869365,erath fresh lightly fruity pinot gris bit substantial new pinot blanc soft fruity simple challenge way stainless steel fermented quintessential quaffer,63,-0.3550441757026992,-1.0571964510798075
553,3,0.9488704800815629,winemaker denis malbec created brilliantly delicious crisp dry yet richly textured version variety open golden honey dried apricot lychee nose mouth minerally steely finish smoky oaky edge,83,0.5095367613073715,0.45470955519741424
554,3,0.35459828734770593,hearty cabernet rich cranberry cassis streak earthy cedar pleasant herbal undertone tannin young still pleading wait air enjoying,12,-0.7873346442077345,0.40882833349540515
555,3,-1.428218290853865,curiously perfumed note roasted hazelnut fresh apple savory dry chardonnay full bodied style note nut oil nut skin throughout end hint wood sap astringency finish,15,0.2213431156373479,-0.9491228357574785
556,1,1.8402787691823483,thanks dense clay soil brunate cru delivers wine high color saturation aromatic caliber barolo offer layer black fruit plum spice tobacco cola dark chocolate firm finely textured power dimension personality long finish,56,1.2300208754824302,1.9245016300797408
557,2,-1.428218290853865,searching identity nose deal menthol licorice grilled meat molasses little bright fruit heaviness transfer mouth marinated baked flavor mix green tomato fails impress,95,-0.06685053003267563,0.45470955519741424
558,3,-0.5368100017530796,pale pink color introduces fairly weak aroma bubble gum freshly squeezed lime one three rosés made proulx rather subtle expression one delivering bit lime decent amount tannic grip would great match anything rich texture light could easily overwhelmed,77,2.0946018124925008,-0.20178837871330557
559,0,2.137414865549277,serious fan rivesaltes must example aroma dried apricot toasted hazelnut fig ginger sweet spice candied orange rind fill bouquet mouth silky heady without cloying aroma transition onto alongside accent walnut skin shiitake mushroom soft salinity make long finish even mouthwatering drink continue age bottle produced,72,3.1032795723375832,4.222248663063424
560,0,-0.23967390538615105,epineuil region burgundy chablis producing light fruity pinot noir perfumed dusty show firm tannin bright red currant raspberry fruit fresh aftertaste,66,-0.3550441757026992,-0.2701472511310363
